{
  "admin": {
    "created": {
      "date": "2018-11-14",
      "schema_version": "1.0"
    },
    "last_modified": {
      "date": "2025-10-28",
      "schema_version": "2.1"
    }
  },
  "domains": [
    "psbedu.paris"
  ],
  "established": 1974,
  "external_ids": [
    {
      "all": [
        "grid.469042.d"
      ],
      "preferred": "grid.469042.d",
      "type": "grid"
    },
    {
      "all": [
        "0000 0004 1781 6786"
      ],
      "preferred": null,
      "type": "isni"
    },
    {
      "all": [
        "Q3578449"
      ],
      "preferred": null,
      "type": "wikidata"
    }
  ],
  "id": "https://ror.org/01y414495",
  "links": [
    {
      "type": "website",
      "value": "https://www.psbedu.paris/fr"
    },
    {
      "type": "wikipedia",
      "value": "https://en.wikipedia.org/wiki/Paris_School_of_Business"
    }
  ],
  "locations": [
    {
      "geonames_details": {
        "continent_code": "EU",
        "continent_name": "Europe",
        "country_code": "FR",
        "country_name": "France",
        "country_subdivision_code": "IDF",
        "country_subdivision_name": "ÃŽle-de-France",
        "lat": 48.85341,
        "lng": 2.3488,
        "name": "Paris"
      },
      "geonames_id": 2988507
    }
  ],
  "names": [
    {
      "lang": "en",
      "types": [
        "alias"
      ],
      "value": "ESG Management School"
    },
    {
      "lang": null,
      "types": [
        "acronym"
      ],
      "value": "PSB"
    },
    {
      "lang": "en",
      "types": [
        "ror_display",
        "label"
      ],
      "value": "Paris School of Business"
    }
  ],
  "relationships": [],
  "status": "active",
  "types": [
    "education"
  ]
}