{
  "admin": {
    "created": {
      "date": "2018-11-14",
      "schema_version": "1.0"
    },
    "last_modified": {
      "date": "2026-06-02",
      "schema_version": "2.1"
    }
  },
  "domains": [],
  "established": 1922,
  "external_ids": [
    {
      "all": [
        "grid.445465.2"
      ],
      "preferred": "grid.445465.2",
      "type": "grid"
    },
    {
      "all": [
        "0000 0004 0621 398X"
      ],
      "preferred": null,
      "type": "isni"
    },
    {
      "all": [
        "Q9143067"
      ],
      "preferred": null,
      "type": "wikidata"
    }
  ],
  "id": "https://ror.org/02w6v9q55",
  "links": [
    {
      "type": "website",
      "value": "http://www.aps.edu.pl/"
    }
  ],
  "locations": [
    {
      "geonames_details": {
        "continent_code": "EU",
        "continent_name": "Europe",
        "country_code": "PL",
        "country_name": "Poland",
        "country_subdivision_code": "14",
        "country_subdivision_name": "Mazovia",
        "lat": 52.22977,
        "lng": 21.01178,
        "name": "Warsaw"
      },
      "geonames_id": 756135
    }
  ],
  "names": [
    {
      "lang": "pl",
      "types": [
        "label"
      ],
      "value": "Akademia Pedagogiki Specjalnej im. Marii Grzegorzewskiej"
    },
    {
      "lang": "en",
      "types": [
        "alias"
      ],
      "value": "Maria Grzegorzewska Academy of Special Education"
    },
    {
      "lang": "en",
      "types": [
        "alias"
      ],
      "value": "Maria Grzegorzewska University"
    },
    {
      "lang": "en",
      "types": [
        "label",
        "ror_display"
      ],
      "value": "The Maria Grzegorzewska University"
    }
  ],
  "relationships": [],
  "status": "active",
  "types": [
    "education"
  ]
}