{
  "admin": {
    "created": {
      "date": "2018-11-14",
      "schema_version": "1.0"
    },
    "last_modified": {
      "date": "2024-07-29",
      "schema_version": "2.0"
    }
  },
  "domains": [],
  "established": 1801,
  "external_ids": [
    {
      "all": [
        "grid.446390.c"
      ],
      "preferred": "grid.446390.c",
      "type": "grid"
    },
    {
      "all": [
        "Q524435"
      ],
      "preferred": "Q524435",
      "type": "wikidata"
    }
  ],
  "id": "https://ror.org/01vhsdf43",
  "links": [
    {
      "type": "website",
      "value": "http://brooklynnavyyard.org/"
    },
    {
      "type": "wikipedia",
      "value": "https://en.wikipedia.org/wiki/Brooklyn_Navy_Yard"
    }
  ],
  "locations": [
    {
      "geonames_details": {
        "country_code": "US",
        "country_name": "United States",
        "lat": 40.6501,
        "lng": -73.94958,
        "name": "Brooklyn"
      },
      "geonames_id": 5110302
    }
  ],
  "names": [
    {
      "lang": null,
      "types": [
        "acronym"
      ],
      "value": "BNY"
    },
    {
      "lang": null,
      "types": [
        "acronym"
      ],
      "value": "BNYDC"
    },
    {
      "lang": "en",
      "types": [
        "ror_display",
        "label"
      ],
      "value": "Brooklyn Navy Yard"
    },
    {
      "lang": "en",
      "types": [
        "alias"
      ],
      "value": "Brooklyn Navy Yard Development Corporation"
    }
  ],
  "relationships": [],
  "status": "active",
  "types": [
    "nonprofit"
  ]
}