{
  "admin": {
    "created": {
      "date": "2026-06-14",
      "schema_version": "2.1"
    },
    "last_modified": {
      "date": "2026-06-23",
      "schema_version": "2.1"
    }
  },
  "domains": [
    "eahad.org"
  ],
  "established": 2007,
  "external_ids": [
    {
      "all": [
        "501100011926"
      ],
      "preferred": "501100011926",
      "type": "fundref"
    }
  ],
  "id": "https://ror.org/05t0gg285",
  "links": [
    {
      "type": "website",
      "value": "https://www.eahad.org"
    }
  ],
  "locations": [
    {
      "geonames_details": {
        "continent_code": "EU",
        "continent_name": "Europe",
        "country_code": "BE",
        "country_name": "Belgium",
        "country_subdivision_code": "BRU",
        "country_subdivision_name": "Brussels Capital",
        "lat": 50.85045,
        "lng": 4.34878,
        "name": "Brussels"
      },
      "geonames_id": 2800866
    }
  ],
  "names": [
    {
      "lang": "en",
      "types": [
        "acronym"
      ],
      "value": "EAHAD"
    },
    {
      "lang": "en",
      "types": [
        "label",
        "ror_display"
      ],
      "value": "European Association for Haemophilia and Allied Disorders"
    }
  ],
  "relationships": [],
  "status": "active",
  "types": [
    "funder",
    "nonprofit"
  ]
}