{
  "admin": {
    "created": {
      "date": "2026-06-14",
      "schema_version": "2.1"
    },
    "last_modified": {
      "date": "2026-06-23",
      "schema_version": "2.1"
    }
  },
  "domains": [
    "grapesfromcalifornia.com"
  ],
  "established": 1967,
  "external_ids": [
    {
      "all": [
        "100015925"
      ],
      "preferred": "100015925",
      "type": "fundref"
    }
  ],
  "id": "https://ror.org/012b6gm34",
  "links": [
    {
      "type": "website",
      "value": "https://www.grapesfromcalifornia.com"
    }
  ],
  "locations": [
    {
      "geonames_details": {
        "continent_code": "NA",
        "continent_name": "North America",
        "country_code": "US",
        "country_name": "United States",
        "country_subdivision_code": "CA",
        "country_subdivision_name": "California",
        "lat": 36.74773,
        "lng": -119.77237,
        "name": "Fresno"
      },
      "geonames_id": 5350937
    }
  ],
  "names": [
    {
      "lang": "en",
      "types": [
        "label",
        "ror_display"
      ],
      "value": "California Table Grape Commission"
    },
    {
      "lang": "en",
      "types": [
        "alias"
      ],
      "value": "California Table Grapes"
    },
    {
      "lang": "en",
      "types": [
        "alias"
      ],
      "value": "Grapes from California"
    }
  ],
  "relationships": [],
  "status": "active",
  "types": [
    "funder",
    "nonprofit"
  ]
}