{
  "admin": {
    "created": {
      "date": "2026-06-23",
      "schema_version": "2.1"
    },
    "last_modified": {
      "date": "2026-06-23",
      "schema_version": "2.1"
    }
  },
  "domains": [
    "aimos.community"
  ],
  "established": 2019,
  "external_ids": [],
  "id": "https://ror.org/0462jy631",
  "links": [
    {
      "type": "website",
      "value": "https://aimos.community"
    }
  ],
  "locations": [
    {
      "geonames_details": {
        "continent_code": "OC",
        "continent_name": "Oceania",
        "country_code": "AU",
        "country_name": "Australia",
        "country_subdivision_code": "VIC",
        "country_subdivision_name": "Victoria",
        "lat": -37.814,
        "lng": 144.96332,
        "name": "Melbourne"
      },
      "geonames_id": 2158177
    }
  ],
  "names": [
    {
      "lang": "en",
      "types": [
        "acronym"
      ],
      "value": "AIMOS"
    },
    {
      "lang": "en",
      "types": [
        "alias"
      ],
      "value": "Association for Interdisciplinary Meta-Research and Open Science"
    },
    {
      "lang": "en",
      "types": [
        "label",
        "ror_display"
      ],
      "value": "Association for Interdisciplinary Metaresearch and Open Science"
    }
  ],
  "relationships": [],
  "status": "active",
  "types": [
    "nonprofit"
  ]
}