{
  "admin": {
    "created": {
      "date": "2018-11-14",
      "schema_version": "1.0"
    },
    "last_modified": {
      "date": "2025-10-28",
      "schema_version": "2.1"
    }
  },
  "domains": [],
  "established": 1870,
  "external_ids": [
    {
      "all": [
        "grid.416187.d"
      ],
      "preferred": "grid.416187.d",
      "type": "grid"
    },
    {
      "all": [
        "0000 0004 0400 8130"
      ],
      "preferred": null,
      "type": "isni"
    },
    {
      "all": [
        "Q7374640"
      ],
      "preferred": null,
      "type": "wikidata"
    }
  ],
  "id": "https://ror.org/030d91z44",
  "links": [
    {
      "type": "website",
      "value": "http://www.pat.nhs.uk/our-hospitals/the-royal-oldham-hospital/"
    },
    {
      "type": "wikipedia",
      "value": "https://en.wikipedia.org/wiki/Royal_Oldham_Hospital"
    }
  ],
  "locations": [
    {
      "geonames_details": {
        "continent_code": "EU",
        "continent_name": "Europe",
        "country_code": "GB",
        "country_name": "United Kingdom",
        "country_subdivision_code": "ENG",
        "country_subdivision_name": "England",
        "lat": 53.54051,
        "lng": -2.1183,
        "name": "Oldham"
      },
      "geonames_id": 2641022
    }
  ],
  "names": [
    {
      "lang": "en",
      "types": [
        "alias"
      ],
      "value": "Oldham and District General Hospital"
    },
    {
      "lang": "en",
      "types": [
        "ror_display",
        "label"
      ],
      "value": "Royal Oldham Hospital"
    }
  ],
  "relationships": [
    {
      "label": "Northern Care Alliance NHS Foundation Trust",
      "type": "parent",
      "id": "https://ror.org/01nqeyn25"
    }
  ],
  "status": "active",
  "types": [
    "healthcare"
  ]
}