{
  "admin": {
    "created": {
      "date": "2026-03-24",
      "schema_version": "2.1"
    },
    "last_modified": {
      "date": "2026-06-23",
      "schema_version": "2.1"
    }
  },
  "domains": [],
  "established": null,
  "external_ids": [],
  "id": "https://ror.org/00e348047",
  "links": [],
  "locations": [
    {
      "geonames_details": {
        "continent_code": "AS",
        "continent_name": "Asia",
        "country_code": "JP",
        "country_name": "Japan",
        "country_subdivision_code": "13",
        "country_subdivision_name": "Tokyo",
        "lat": 35.68449,
        "lng": 139.75056,
        "name": "Chiyoda City"
      },
      "geonames_id": 11749713
    }
  ],
  "names": [
    {
      "lang": null,
      "types": [
        "alias"
      ],
      "value": "ID Pharma"
    },
    {
      "lang": null,
      "types": [
        "label"
      ],
      "value": "ID Pharma Co., Ltd."
    },
    {
      "lang": null,
      "types": [
        "label",
        "ror_display"
      ],
      "value": "ID Pharma Co., Ltd. (Japan)"
    },
    {
      "lang": "ja",
      "types": [
        "label"
      ],
      "value": "株式会社IDファーマ"
    }
  ],
  "relationships": [
    {
      "label": "ID Pharma (Japan)",
      "type": "successor",
      "id": "https://ror.org/05yk8hs36"
    }
  ],
  "status": "withdrawn",
  "types": [
    "company"
  ]
}