{
  "admin": {
    "created": {
      "date": "2018-11-14",
      "schema_version": "1.0"
    },
    "last_modified": {
      "date": "2026-05-05",
      "schema_version": "2.1"
    }
  },
  "domains": [
    "heanet.ie"
  ],
  "established": 1983,
  "external_ids": [
    {
      "all": [
        "grid.435211.0"
      ],
      "preferred": "grid.435211.0",
      "type": "grid"
    },
    {
      "all": [
        "0000 0004 0518 964X"
      ],
      "preferred": null,
      "type": "isni"
    },
    {
      "all": [
        "Q5629412"
      ],
      "preferred": null,
      "type": "wikidata"
    }
  ],
  "id": "https://ror.org/04hxxzz17",
  "links": [
    {
      "type": "website",
      "value": "https://www.heanet.ie"
    },
    {
      "type": "wikipedia",
      "value": "https://en.wikipedia.org/wiki/HEAnet"
    }
  ],
  "locations": [
    {
      "geonames_details": {
        "continent_code": "EU",
        "continent_name": "Europe",
        "country_code": "IE",
        "country_name": "Ireland",
        "country_subdivision_code": "L",
        "country_subdivision_name": "Leinster",
        "lat": 53.33306,
        "lng": -6.24889,
        "name": "Dublin"
      },
      "geonames_id": 2964574
    }
  ],
  "names": [
    {
      "lang": null,
      "types": [
        "ror_display",
        "label"
      ],
      "value": "HEAnet"
    }
  ],
  "relationships": [
    {
      "label": "Asiera (Ireland)",
      "type": "successor",
      "id": "https://ror.org/05p8mqd12"
    }
  ],
  "status": "inactive",
  "types": [
    "other"
  ]
}