{
  "admin": {
    "created": {
      "date": "2026-05-04",
      "schema_version": "2.1"
    },
    "last_modified": {
      "date": "2026-05-05",
      "schema_version": "2.1"
    }
  },
  "domains": [
    "ncvb.kz"
  ],
  "established": 1977,
  "external_ids": [
    {
      "all": [
        "0000 0004 0387 7756"
      ],
      "preferred": "0000 0004 0387 7756",
      "type": "isni"
    }
  ],
  "id": "https://ror.org/026b73g96",
  "links": [
    {
      "type": "website",
      "value": "https://ncvb.kz"
    }
  ],
  "locations": [
    {
      "geonames_details": {
        "continent_code": "AS",
        "continent_name": "Asia",
        "country_code": "KZ",
        "country_name": "Kazakhstan",
        "country_subdivision_code": "75",
        "country_subdivision_name": "Almaty",
        "lat": 43.25249,
        "lng": 76.9115,
        "name": "Almaty"
      },
      "geonames_id": 1526384
    }
  ],
  "names": [
    {
      "lang": "kk",
      "types": [
        "label"
      ],
      "value": "\"Кардиология және ішкі ауруларғылыми-зерттеу институты\" АҚ"
    },
    {
      "lang": "en",
      "types": [
        "label",
        "ror_display"
      ],
      "value": "JSC \"Research Institute of Cardiology and Internal Diseases\""
    },
    {
      "lang": "en",
      "types": [
        "alias"
      ],
      "value": "JSC Research Institute of Cardiology and Internal Diseases"
    },
    {
      "lang": "en",
      "types": [
        "alias"
      ],
      "value": "Research Institute of Cardiology and Internal Diseases"
    },
    {
      "lang": "ru",
      "types": [
        "alias"
      ],
      "value": "АО \"НИИ КВБ\""
    },
    {
      "lang": "ru",
      "types": [
        "label"
      ],
      "value": "АО «Научно-исследовательский институт кардиологии и внутренних болезней»"
    },
    {
      "lang": "ru",
      "types": [
        "alias"
      ],
      "value": "АО НИИ кардиологии и внутренних болезней"
    },
    {
      "lang": "kk",
      "types": [
        "alias"
      ],
      "value": "Кардиология және ішкі аурулар ғылыми-зерттеу институты"
    }
  ],
  "relationships": [],
  "status": "active",
  "types": [
    "facility",
    "healthcare"
  ]
}