{
  "admin": {
    "created": {
      "date": "2024-08-19",
      "schema_version": "2.0"
    },
    "last_modified": {
      "date": "2024-08-21",
      "schema_version": "2.0"
    }
  },
  "domains": [
    "mosaicco.com"
  ],
  "established": null,
  "external_ids": [
    {
      "all": [
        "100011350"
      ],
      "preferred": "100011350",
      "type": "fundref"
    },
    {
      "all": [
        "Q7752327"
      ],
      "preferred": "Q7752327",
      "type": "wikidata"
    }
  ],
  "id": "https://ror.org/01xc2fv34",
  "links": [
    {
      "type": "website",
      "value": "https://www.mosaicco.com"
    },
    {
      "type": "wikipedia",
      "value": "https://en.wikipedia.org/wiki/The_Mosaic_Company"
    }
  ],
  "locations": [
    {
      "geonames_details": {
        "country_code": "US",
        "country_name": "United States",
        "lat": 27.94752,
        "lng": -82.45843,
        "name": "Tampa"
      },
      "geonames_id": 4174757
    }
  ],
  "names": [
    {
      "lang": "de",
      "types": [
        "alias"
      ],
      "value": "Mosaic Co"
    },
    {
      "lang": "en",
      "types": [
        "label"
      ],
      "value": "Mosaic Company"
    },
    {
      "lang": "en",
      "types": [
        "label",
        "ror_display"
      ],
      "value": "Mosaic Company (United States)"
    },
    {
      "lang": "en",
      "types": [
        "alias"
      ],
      "value": "The Mosaic Co"
    }
  ],
  "relationships": [],
  "status": "active",
  "types": [
    "company",
    "funder"
  ]
}