{
  "admin": {
    "created": {
      "date": "2018-11-14",
      "schema_version": "1.0"
    },
    "last_modified": {
      "date": "2025-10-28",
      "schema_version": "2.1"
    }
  },
  "domains": [
    "kiryu-u.ac.jp"
  ],
  "established": 1901,
  "external_ids": [
    {
      "all": [
        "grid.448781.6"
      ],
      "preferred": "grid.448781.6",
      "type": "grid"
    },
    {
      "all": [
        "0000 0004 0638 7154"
      ],
      "preferred": null,
      "type": "isni"
    },
    {
      "all": [
        "Q6416339"
      ],
      "preferred": null,
      "type": "wikidata"
    }
  ],
  "id": "https://ror.org/02snehe53",
  "links": [
    {
      "type": "website",
      "value": "https://www.kiryu-u.ac.jp"
    },
    {
      "type": "wikipedia",
      "value": "https://en.wikipedia.org/wiki/Kiryu_University"
    }
  ],
  "locations": [
    {
      "geonames_details": {
        "continent_code": "AS",
        "continent_name": "Asia",
        "country_code": "JP",
        "country_name": "Japan",
        "country_subdivision_code": "10",
        "country_subdivision_name": "Gunma",
        "lat": 36.44492,
        "lng": 139.28448,
        "name": "Midori"
      },
      "geonames_id": 6822155
    }
  ],
  "names": [
    {
      "lang": "en",
      "types": [
        "ror_display",
        "label"
      ],
      "value": "Kiryu University"
    },
    {
      "lang": "ja",
      "types": [
        "label"
      ],
      "value": "桐生大学"
    }
  ],
  "relationships": [],
  "status": "active",
  "types": [
    "education"
  ]
}