{
  "admin": {
    "created": {
      "date": "2026-05-30",
      "schema_version": "2.1"
    },
    "last_modified": {
      "date": "2026-06-02",
      "schema_version": "2.1"
    }
  },
  "domains": [
    "bgi-nutri.com"
  ],
  "established": null,
  "external_ids": [],
  "id": "https://ror.org/00em1jy13",
  "links": [
    {
      "type": "website",
      "value": "https://www.bgi-nutri.com"
    }
  ],
  "locations": [
    {
      "geonames_details": {
        "continent_code": "AS",
        "continent_name": "Asia",
        "country_code": "CN",
        "country_name": "China",
        "country_subdivision_code": "GD",
        "country_subdivision_name": "Guangdong",
        "lat": 22.54554,
        "lng": 114.0683,
        "name": "Shenzhen"
      },
      "geonames_id": 1795565
    }
  ],
  "names": [
    {
      "lang": null,
      "types": [
        "alias"
      ],
      "value": "BGI Nutri"
    },
    {
      "lang": null,
      "types": [
        "alias"
      ],
      "value": "BGI Precision Nutrition (Shenzhen) Technology Co., Limited"
    },
    {
      "lang": null,
      "types": [
        "label"
      ],
      "value": "BGI Precision Nutrition (Shenzhen) Technology Co., Ltd."
    },
    {
      "lang": null,
      "types": [
        "label",
        "ror_display"
      ],
      "value": "BGI Precision Nutrition (Shenzhen) Technology Co., Ltd. (China)"
    },
    {
      "lang": null,
      "types": [
        "label"
      ],
      "value": "华大精准营养（深圳）科技有限公司"
    },
    {
      "lang": null,
      "types": [
        "label"
      ],
      "value": "华大精准营养（深圳）科技有限公司 (China)"
    }
  ],
  "relationships": [],
  "status": "active",
  "types": [
    "company"
  ]
}