{
  "admin": {
    "created": {
      "date": "2026-06-14",
      "schema_version": "2.1"
    },
    "last_modified": {
      "date": "2026-06-23",
      "schema_version": "2.1"
    }
  },
  "domains": [
    "vnmt.org"
  ],
  "established": 2010,
  "external_ids": [
    {
      "all": [
        "501100017573"
      ],
      "preferred": "501100017573",
      "type": "fundref"
    }
  ],
  "id": "https://ror.org/04shvqp53",
  "links": [
    {
      "type": "website",
      "value": "https://www.vnmt.org"
    }
  ],
  "locations": [
    {
      "geonames_details": {
        "continent_code": "OC",
        "continent_name": "Oceania",
        "country_code": "AU",
        "country_name": "Australia",
        "country_subdivision_code": "VIC",
        "country_subdivision_name": "Victoria",
        "lat": -37.53078,
        "lng": 143.82838,
        "name": "Wendouree"
      },
      "geonames_id": 2144139
    }
  ],
  "names": [
    {
      "lang": "en",
      "types": [
        "acronym"
      ],
      "value": "NBVLL"
    },
    {
      "lang": "en",
      "types": [
        "alias"
      ],
      "value": "Nurses Board of Victoria Legacy Limited"
    },
    {
      "lang": "en",
      "types": [
        "alias"
      ],
      "value": "Nurses Board of Victoria Legacy Ltd"
    },
    {
      "lang": "en",
      "types": [
        "alias"
      ],
      "value": "Nurses Board of Victoria Legacy Trust"
    },
    {
      "lang": "en",
      "types": [
        "alias"
      ],
      "value": "The Nurses Board of Victoria Legacy Trust"
    },
    {
      "lang": "en",
      "types": [
        "label",
        "ror_display"
      ],
      "value": "The Victorian Nurses and Midwives Trust"
    },
    {
      "lang": "en",
      "types": [
        "acronym"
      ],
      "value": "VNMT"
    }
  ],
  "relationships": [],
  "status": "active",
  "types": [
    "funder",
    "nonprofit"
  ]
}