{
  "admin": {
    "created": {
      "date": "2018-11-14",
      "schema_version": "1.0"
    },
    "last_modified": {
      "date": "2024-08-21",
      "schema_version": "2.0"
    }
  },
  "domains": [],
  "established": 1876,
  "external_ids": [
    {
      "all": [
        "100016193",
        "100014450"
      ],
      "preferred": "100014450",
      "type": "fundref"
    },
    {
      "all": [
        "grid.430503.1"
      ],
      "preferred": "grid.430503.1",
      "type": "grid"
    },
    {
      "all": [
        "0000 0001 0703 675X"
      ],
      "preferred": null,
      "type": "isni"
    },
    {
      "all": [
        "Q4770537"
      ],
      "preferred": null,
      "type": "wikidata"
    }
  ],
  "id": "https://ror.org/03wmf1y16",
  "links": [
    {
      "type": "website",
      "value": "https://www.cuanschutz.edu/"
    },
    {
      "type": "wikipedia",
      "value": "http://en.wikipedia.org/wiki/Anschutz_Medical_Campus"
    }
  ],
  "locations": [
    {
      "geonames_details": {
        "country_code": "US",
        "country_name": "United States",
        "lat": 39.72943,
        "lng": -104.83192,
        "name": "Aurora"
      },
      "geonames_id": 5412347
    }
  ],
  "names": [
    {
      "lang": "en",
      "types": [
        "alias"
      ],
      "value": "CU Anschutz Medical Campus"
    },
    {
      "lang": "en",
      "types": [
        "ror_display",
        "label"
      ],
      "value": "University of Colorado Anschutz Medical Campus"
    }
  ],
  "relationships": [
    {
      "label": "University of Colorado Cancer Center",
      "type": "related",
      "id": "https://ror.org/04cqn7d42"
    },
    {
      "label": "University of Colorado Hospital",
      "type": "related",
      "id": "https://ror.org/006jjmw19"
    },
    {
      "label": "Rocky Mountain Advanced Computing Consortium",
      "type": "related",
      "id": "https://ror.org/019q0z051"
    }
  ],
  "status": "active",
  "types": [
    "education",
    "funder"
  ]
}