{
  "admin": {
    "created": {
      "date": "2024-08-19",
      "schema_version": "2.0"
    },
    "last_modified": {
      "date": "2024-08-21",
      "schema_version": "2.0"
    }
  },
  "domains": [
    "comerica.com"
  ],
  "established": null,
  "external_ids": [
    {
      "all": [
        "0000 0004 0438 2739"
      ],
      "preferred": "0000 0004 0438 2739",
      "type": "isni"
    },
    {
      "all": [
        "Q1114148"
      ],
      "preferred": "Q1114148",
      "type": "wikidata"
    }
  ],
  "id": "https://ror.org/008khdx92",
  "links": [
    {
      "type": "website",
      "value": "https://www.comerica.com"
    }
  ],
  "locations": [
    {
      "geonames_details": {
        "country_code": "US",
        "country_name": "United States",
        "lat": 32.78306,
        "lng": -96.80667,
        "name": "Dallas"
      },
      "geonames_id": 4684888
    }
  ],
  "names": [
    {
      "lang": "en",
      "types": [
        "label"
      ],
      "value": "Comerica"
    },
    {
      "lang": "en",
      "types": [
        "label",
        "ror_display"
      ],
      "value": "Comerica (United States)"
    },
    {
      "lang": "en",
      "types": [
        "alias"
      ],
      "value": "Comerica Bank"
    },
    {
      "lang": "en",
      "types": [
        "alias"
      ],
      "value": "Comerica Inc"
    },
    {
      "lang": "en",
      "types": [
        "alias"
      ],
      "value": "Comerica Incorporated"
    }
  ],
  "relationships": [],
  "status": "active",
  "types": [
    "company"
  ]
}