{
  "admin": {
    "created": {
      "date": "2018-11-14",
      "schema_version": "1.0"
    },
    "last_modified": {
      "date": "2026-05-05",
      "schema_version": "2.1"
    }
  },
  "domains": [
    "pasteur.ci"
  ],
  "established": 1972,
  "external_ids": [
    {
      "all": [
        "grid.418523.9"
      ],
      "preferred": "grid.418523.9",
      "type": "grid"
    },
    {
      "all": [
        "0000 0004 0475 3667"
      ],
      "preferred": null,
      "type": "isni"
    }
  ],
  "id": "https://ror.org/046p4xa68",
  "links": [
    {
      "type": "website",
      "value": "https://pasteur.ci"
    }
  ],
  "locations": [
    {
      "geonames_details": {
        "continent_code": "AF",
        "continent_name": "Africa",
        "country_code": "CI",
        "country_name": "Ivory Coast",
        "country_subdivision_code": "AB",
        "country_subdivision_name": "Abidjan Autonomous District",
        "lat": 5.35444,
        "lng": -4.00167,
        "name": "Abidjan"
      },
      "geonames_id": 2293538
    }
  ],
  "names": [
    {
      "lang": null,
      "types": [
        "acronym"
      ],
      "value": "IPCI"
    },
    {
      "lang": "fr",
      "types": [
        "ror_display",
        "label"
      ],
      "value": "Institut Pasteur de Côte d'Ivoire"
    }
  ],
  "relationships": [
    {
      "label": "Institut Pasteur",
      "type": "related",
      "id": "https://ror.org/0495fxg12"
    },
    {
      "label": "Pasteur Network",
      "type": "related",
      "id": "https://ror.org/04cb2ne58"
    }
  ],
  "status": "active",
  "types": [
    "nonprofit"
  ]
}