{
  "admin": {
    "created": {
      "date": "2018-11-14",
      "schema_version": "1.0"
    },
    "last_modified": {
      "date": "2026-06-23",
      "schema_version": "2.1"
    }
  },
  "domains": [
    "scu.edu.cn"
  ],
  "established": 1740,
  "external_ids": [
    {
      "all": [
        "501100004912"
      ],
      "preferred": null,
      "type": "fundref"
    },
    {
      "all": [
        "grid.13291.38"
      ],
      "preferred": "grid.13291.38",
      "type": "grid"
    },
    {
      "all": [
        "0000 0001 0807 1581"
      ],
      "preferred": null,
      "type": "isni"
    },
    {
      "all": [
        "Q2281517"
      ],
      "preferred": null,
      "type": "wikidata"
    }
  ],
  "id": "https://ror.org/011ashp19",
  "links": [
    {
      "type": "website",
      "value": "https://scu.edu.cn"
    },
    {
      "type": "wikipedia",
      "value": "http://en.wikipedia.org/wiki/Sichuan_University"
    }
  ],
  "locations": [
    {
      "geonames_details": {
        "continent_code": "AS",
        "continent_name": "Asia",
        "country_code": "CN",
        "country_name": "China",
        "country_subdivision_code": "SC",
        "country_subdivision_name": "Sichuan",
        "lat": 30.66667,
        "lng": 104.06667,
        "name": "Chengdu"
      },
      "geonames_id": 1815286
    }
  ],
  "names": [
    {
      "lang": null,
      "types": [
        "acronym"
      ],
      "value": "SCU"
    },
    {
      "lang": "en",
      "types": [
        "ror_display",
        "label"
      ],
      "value": "Sichuan University"
    },
    {
      "lang": null,
      "types": [
        "alias"
      ],
      "value": "Sìchuān Dàxué"
    },
    {
      "lang": "zh",
      "types": [
        "label"
      ],
      "value": "四川大学"
    }
  ],
  "relationships": [
    {
      "label": "West China Medical Center of Sichuan University",
      "type": "child",
      "id": "https://ror.org/040nggs60"
    },
    {
      "label": "State Key Laboratory of Biotherapy",
      "type": "child",
      "id": "https://ror.org/00x43yy22"
    },
    {
      "label": "State Key Laboratory of Oral Diseases",
      "type": "child",
      "id": "https://ror.org/00pvqk557"
    },
    {
      "label": "State Key Laboratory of Hydraulics and Mountain River Engineering",
      "type": "child",
      "id": "https://ror.org/02169wb20"
    },
    {
      "label": "State Key Laboratory of Polymer Materials Engineering",
      "type": "child",
      "id": "https://ror.org/02rbzhv36"
    },
    {
      "label": "West China Hospital of Sichuan University",
      "type": "related",
      "id": "https://ror.org/007mrxy13"
    },
    {
      "label": "West China Second University Hospital of Sichuan University",
      "type": "related",
      "id": "https://ror.org/00726et14"
    },
    {
      "label": "The First People's Hospital of Shuangliu District",
      "type": "related",
      "id": "https://ror.org/04cjrj888"
    }
  ],
  "status": "active",
  "types": [
    "education",
    "funder"
  ]
}