{
  "admin": {
    "created": {
      "date": "2018-11-14",
      "schema_version": "1.0"
    },
    "last_modified": {
      "date": "2025-10-28",
      "schema_version": "2.1"
    }
  },
  "domains": [
    "klinikum-fulda.de"
  ],
  "established": 1976,
  "external_ids": [
    {
      "all": [
        "grid.419818.d"
      ],
      "preferred": "grid.419818.d",
      "type": "grid"
    },
    {
      "all": [
        "0000 0001 0002 5193"
      ],
      "preferred": null,
      "type": "isni"
    }
  ],
  "id": "https://ror.org/04jmqe852",
  "links": [
    {
      "type": "website",
      "value": "https://klinikum-fulda.de"
    }
  ],
  "locations": [
    {
      "geonames_details": {
        "continent_code": "EU",
        "continent_name": "Europe",
        "country_code": "DE",
        "country_name": "Germany",
        "country_subdivision_code": "HE",
        "country_subdivision_name": "Hesse",
        "lat": 50.55162,
        "lng": 9.67518,
        "name": "Fulda"
      },
      "geonames_id": 2923822
    }
  ],
  "names": [
    {
      "lang": "de",
      "types": [
        "ror_display",
        "label"
      ],
      "value": "Klinikum Fulda"
    }
  ],
  "relationships": [
    {
      "label": "Philipps University of Marburg",
      "type": "related",
      "id": "https://ror.org/01rdrb571"
    }
  ],
  "status": "active",
  "types": [
    "healthcare"
  ]
}