{
  "admin": {
    "created": {
      "date": "2026-06-14",
      "schema_version": "2.1"
    },
    "last_modified": {
      "date": "2026-06-23",
      "schema_version": "2.1"
    }
  },
  "domains": [
    "visionclub.ca"
  ],
  "established": 2003,
  "external_ids": [
    {
      "all": [
        "100008498"
      ],
      "preferred": "100008498",
      "type": "fundref"
    }
  ],
  "id": "https://ror.org/0335r7f92",
  "links": [
    {
      "type": "website",
      "value": "https://www.visionclub.ca"
    }
  ],
  "locations": [
    {
      "geonames_details": {
        "continent_code": "NA",
        "continent_name": "North America",
        "country_code": "CA",
        "country_name": "Canada",
        "country_subdivision_code": "ON",
        "country_subdivision_name": "Ontario",
        "lat": 43.80011,
        "lng": -79.48291,
        "name": "Concord"
      },
      "geonames_id": 5926526
    }
  ],
  "names": [
    {
      "lang": "en",
      "types": [
        "label",
        "ror_display"
      ],
      "value": "Brandan's Eye Research Foundation"
    }
  ],
  "relationships": [],
  "status": "active",
  "types": [
    "funder",
    "nonprofit"
  ]
}