{
  "admin": {
    "created": {
      "date": "2026-06-14",
      "schema_version": "2.1"
    },
    "last_modified": {
      "date": "2026-06-23",
      "schema_version": "2.1"
    }
  },
  "domains": [
    "fondationpierredeniker.org"
  ],
  "established": 2007,
  "external_ids": [
    {
      "all": [
        "501100008312"
      ],
      "preferred": "501100008312",
      "type": "fundref"
    }
  ],
  "id": "https://ror.org/00tqf7777",
  "links": [
    {
      "type": "website",
      "value": "https://www.fondationpierredeniker.org"
    }
  ],
  "locations": [
    {
      "geonames_details": {
        "continent_code": "EU",
        "continent_name": "Europe",
        "country_code": "FR",
        "country_name": "France",
        "country_subdivision_code": "IDF",
        "country_subdivision_name": "Île-de-France",
        "lat": 48.85341,
        "lng": 2.3488,
        "name": "Paris"
      },
      "geonames_id": 2988507
    }
  ],
  "names": [
    {
      "lang": "fr",
      "types": [
        "alias"
      ],
      "value": "Fondation Pierre Deniker"
    },
    {
      "lang": "fr",
      "types": [
        "label",
        "ror_display"
      ],
      "value": "Fondation Pierre Deniker pour la Recherche et la Prévention en Santé Mentale"
    },
    {
      "lang": "en",
      "types": [
        "alias"
      ],
      "value": "Pierre Deniker Foundation"
    }
  ],
  "relationships": [],
  "status": "active",
  "types": [
    "funder",
    "nonprofit"
  ]
}