{
  "admin": {
    "created": {
      "date": "2026-06-14",
      "schema_version": "2.1"
    },
    "last_modified": {
      "date": "2026-06-23",
      "schema_version": "2.1"
    }
  },
  "domains": [
    "ilp.upmc.fr"
  ],
  "established": 2011,
  "external_ids": [
    {
      "all": [
        "501100014224"
      ],
      "preferred": "501100014224",
      "type": "fundref"
    }
  ],
  "id": "https://ror.org/04kvwhe72",
  "links": [
    {
      "type": "website",
      "value": "http://ilp.upmc.fr"
    }
  ],
  "locations": [
    {
      "geonames_details": {
        "continent_code": "EU",
        "continent_name": "Europe",
        "country_code": "FR",
        "country_name": "France",
        "country_subdivision_code": "IDF",
        "country_subdivision_name": "Île-de-France",
        "lat": 48.85341,
        "lng": 2.3488,
        "name": "Paris"
      },
      "geonames_id": 2988507
    }
  ],
  "names": [
    {
      "lang": "fr",
      "types": [
        "acronym"
      ],
      "value": "ILP"
    },
    {
      "lang": "fr",
      "types": [
        "label",
        "ror_display"
      ],
      "value": "Institut Lagrange de Paris"
    },
    {
      "lang": "en",
      "types": [
        "alias"
      ],
      "value": "The Lagrange Institute, Paris"
    }
  ],
  "relationships": [],
  "status": "inactive",
  "types": [
    "facility",
    "funder"
  ]
}