{
  "admin": {
    "created": {
      "date": "2024-08-19",
      "schema_version": "2.0"
    },
    "last_modified": {
      "date": "2024-08-21",
      "schema_version": "2.0"
    }
  },
  "domains": [],
  "established": null,
  "external_ids": [
    {
      "all": [
        "Q51782558"
      ],
      "preferred": "Q51782558",
      "type": "wikidata"
    }
  ],
  "id": "https://ror.org/03zhyf578",
  "links": [
    {
      "type": "website",
      "value": "https://ur-geco.cirad.fr"
    }
  ],
  "locations": [
    {
      "geonames_details": {
        "country_code": "FR",
        "country_name": "France",
        "lat": 48.85341,
        "lng": 2.3488,
        "name": "Paris"
      },
      "geonames_id": 2988507
    }
  ],
  "names": [
    {
      "lang": "fr",
      "types": [
        "label",
        "ror_display"
      ],
      "value": "Fonctionnement écologique et gestion durable des agrosystèmes bananiers et ananas"
    },
    {
      "lang": "en",
      "types": [
        "label"
      ],
      "value": "Functioning and Sustainable Management of Banana and Pineapple"
    },
    {
      "lang": "fr",
      "types": [
        "alias"
      ],
      "value": "UPR Geco"
    },
    {
      "lang": "fr",
      "types": [
        "alias"
      ],
      "value": "Unité de recherche Geco"
    }
  ],
  "relationships": [
    {
      "label": "Centre de Coopération Internationale en Recherche Agronomique pour le Développement",
      "type": "parent",
      "id": "https://ror.org/05kpkpg04"
    }
  ],
  "status": "active",
  "types": [
    "facility"
  ]
}